<?xml version="1.0" encoding="UTF-8"?>
<types xmlns="http://www.qeo.org/formal/2013/Qeo_Data_Model" 
        xmlns:xsi="http://www.w3.org/2001/XMLSchema-instance"
        xsi:schemaLocation="http://www.qeo.org/formal/2013/Qeo_Data_Model qeo_qdm.xsd" version="0.1">
        
  <module name="org::qeo::system">
    <struct name="DeviceId">       
       <doc>this is the device ID generated by Qeo. </doc>
       <member name="upper" type="int64">
           <doc>Upper 64-bit of identifier.</doc>
       </member>
       <member name="lower" type="int64">
           <doc>Lower 64-bit of identifier.</doc>
       </member>
    </struct>
  </module>

  <module name="org::qeo">
    <struct name="UUID">       
       <doc>A generic 128-bit UUID.</doc>
       <member name="upper" type="int64">
           <doc>Upper 64-bit of identifier.</doc>
       </member>
       <member name="lower" type="int64">
           <doc>Lower 64-bit of identifier.</doc>
       </member>
    </struct>
  </module>
</types>
